id,comment,created_at,name,recipe_id,update_at,user_id
1,Half list her officer a.,2022-02-07T22:41:31,Daniel Lewis,59,2024-01-25T07:29:36,19
2,Son although many sometimes.,2022-03-02T07:43:03,Randy Arroyo,129,2022-03-25T19:00:01,5
3,Some blue business pass just wait institution final.,2023-06-25T02:55:09,John Bowers,130,2020-09-02T00:49:39,17
4,Effort section own wall science.,2023-10-25T00:43:57,Dr. Scott Young DVM,101,2021-10-17T17:14:58,5
5,Suggest picture generation house.,2024-04-02T05:37:11,Kevin Gonzales,101,2024-10-03T07:48:07,24
6,Individual color continue ready defense.,2023-09-24T10:31:58,Jason Zamora,100,2024-05-16T10:14:57,26
7,Final reason term prove beat.,2021-09-08T02:11:22,Frances Brown,117,2021-10-10T15:23:44,12
8,World tonight year democratic adult door collection of.,2024-03-31T22:06:17,Elizabeth Perkins,64,2024-03-24T04:29:43,19
9,Conference pick pay painting wife lose including.,2022-10-10T19:50:37,Robert Romero PhD,50,2021-09-25T13:59:48,4
10,Do question population economic industry.,2020-12-11T10:19:13,Debra Johnson,52,2021-06-19T02:53:25,9
11,Better last sit which owner throw minute.,2021-07-29T16:12:27,Amanda Murphy,100,2023-01-09T14:45:52,18
12,Mind sell character water.,2024-05-23T02:26:10,Donald Baldwin,79,2021-12-09T22:30:01,23
13,It be style short.,2025-02-21T06:29:56,Hannah Higgins,127,2024-06-19T02:39:48,29
14,Type their oil series recognize nature.,2022-12-05T14:37:39,Nathan Collins,111,2021-03-20T10:59:02,19
15,Nature enough we education.,2023-09-28T08:48:51,Mr. Peter Hernandez,66,2024-02-03T20:42:19,6
16,Bank employee deal necessary dog unit.,2024-03-21T14:45:26,Samantha Holt,87,2022-10-20T03:59:40,29
17,Age outside mention.,2021-03-28T00:37:57,Olivia Jenkins,116,2021-12-16T20:13:26,23
18,Executive loss mean necessary require certainly.,2025-03-20T05:33:26,Melissa Kelly,48,2021-03-10T23:03:20,18
19,Marriage student form apply write.,2024-11-15T02:20:35,Hannah Herrera,45,2020-11-06T16:20:20,11
20,Whether prevent official three although participant must.,2020-05-09T18:12:54,Matthew Sanchez,24,2022-05-18T11:22:10,5
21,Look protect somebody black ready.,2020-11-14T08:50:46,Kevin Hale,73,2024-07-03T15:46:31,18
22,Red risk note care sure.,2021-01-28T20:08:51,Charles Martinez,122,2025-03-02T01:39:15,27
23,Member treatment once message role western lawyer.,2022-04-21T12:51:12,Justin Stevens,72,2023-01-30T13:23:17,4
24,Prepare night medical finish car group.,2023-11-11T03:18:27,Amanda Jacobs,41,2021-01-08T15:15:49,6
25,Father recognize single go any.,2025-03-16T00:40:52,Jennifer Nguyen,123,2020-08-04T13:23:25,21
26,Perform event use million there quickly community material.,2021-09-02T15:03:39,Brandon David,25,2024-04-07T03:12:59,23
27,Reflect explain free use.,2020-08-22T16:05:26,Amy Kelly,75,2024-09-05T05:35:58,4
28,Figure chair still everyone religious TV.,2023-11-09T20:28:03,Seth Holder,32,2021-08-16T13:03:25,7
29,Body impact enough my with.,2020-02-03T03:20:02,Wesley Morris,89,2023-05-07T23:48:18,18
30,Image American would whole cultural.,2020-11-03T13:47:50,Kevin Gordon,73,2024-09-01T22:08:59,8
31,Number long from girl stop piece government.,2020-01-13T21:33:52,Amber Montgomery,99,2022-02-15T16:42:46,16
32,Perhaps yard surface.,2020-07-26T19:43:53,Mary Miller,119,2020-11-06T23:56:12,26
33,Situation international story establish make method bar.,2021-11-10T02:13:24,Shawn Christensen,95,2020-01-02T09:45:30,18
34,White speak ago degree hold response build.,2024-02-01T21:35:33,Susan Olson,41,2024-02-18T04:57:06,13
35,Play some almost home poor.,2024-01-08T06:00:19,Audrey Wright,94,2021-03-08T04:55:42,2
36,Bank perform suddenly because hope have worry beat.,2022-05-24T01:17:02,Karen Allen,11,2020-05-28T20:43:34,21
37,Generation task nature.,2024-01-06T10:29:29,Carla Hughes,71,2021-03-29T01:39:18,26
38,Address another why poor interview night page.,2022-06-28T00:37:34,John Clay,43,2023-02-09T20:23:39,9
39,Really budget recent direction expert adult only.,2025-01-16T00:03:38,Daniel Garner,3,2021-12-18T22:52:00,13
40,Score feel former agree.,2021-01-21T08:57:45,Thomas Weber,91,2020-09-10T09:06:25,14
41,Middle main ball key idea.,2022-05-31T20:01:20,Jacob Peterson,58,2021-12-08T08:59:18,4
42,View read probably common direction after need night.,2020-12-07T06:26:23,Albert Yoder,76,2023-07-01T20:48:14,7
43,Itself unit want friend.,2024-09-09T03:08:36,Ethan Scott,118,2020-03-30T11:12:25,3
44,Single bank concern another above.,2021-08-30T05:04:14,Amanda Willis,102,2022-12-31T17:29:58,28
45,Wrong culture wish single.,2022-07-28T13:23:25,Jeffery Curry,107,2021-07-19T18:50:11,14
46,North live fill couple little especially.,2022-07-29T16:20:37,Julie Nash,25,2024-10-08T15:29:02,1
47,Easy method nothing reach economy.,2021-08-01T20:16:28,Catherine Scott,127,2022-04-22T02:16:49,21
48,Forget street anything page prepare chair.,2021-10-19T11:45:10,Jordan Kennedy,21,2024-11-04T20:18:19,22
49,Character and up pretty science.,2020-09-19T19:44:38,Darlene Mccarty,48,2022-09-30T16:29:39,24
50,Move inside eight four before ground daughter of.,2025-02-09T16:20:50,Laura Neal,110,2023-10-07T08:30:49,18
51,Pattern development color perform.,2020-09-08T11:26:19,Robin Koch,81,2020-12-09T22:36:24,17
52,Technology fear international explain nature hair news.,2023-05-09T01:31:45,April Holt,20,2020-09-18T05:01:41,28
53,Include address boy respond remember energy.,2021-12-17T08:24:39,Jacqueline Reid,100,2020-11-12T01:45:58,7
54,Some generation since public ten.,2020-11-04T04:38:55,April Ramirez,82,2021-01-08T09:07:58,6
55,About significant upon item together stop.,2024-05-13T17:51:44,Larry Holt,115,2024-05-27T17:02:35,10
56,Address central career any off before.,2024-06-29T02:09:05,Trevor Young,120,2022-06-11T03:17:35,12
57,Turn performance very television avoid reduce play.,2022-04-29T03:53:42,Courtney Sanders,20,2020-07-16T16:14:02,10
58,Rather apply step reduce simply policy partner.,2021-04-05T12:34:28,Larry Thomas,47,2023-01-03T06:52:03,7
59,Chair establish others realize voice one fear.,2021-03-16T16:24:17,Derrick Gibson,87,2022-06-28T11:33:00,23
60,Whatever new fire role.,2021-05-05T05:58:27,Justin Gregory,15,2021-02-13T18:20:21,21
61,Dream region name candidate range senior.,2022-03-18T05:24:27,Brandon Goodwin,28,2022-02-14T03:03:06,3
62,Wear medical official ask above stop case.,2024-02-05T00:53:06,Amber Lopez,54,2022-10-10T19:39:36,11
63,Administration pick full town.,2023-01-15T23:48:46,Paul Smith,110,2024-09-18T18:13:27,26
64,Five foreign among author.,2025-01-12T00:12:33,Tammy Fox,130,2020-05-03T08:37:40,20
65,Sure close save major adult theory.,2020-11-20T09:25:59,Savannah Lee,122,2021-06-21T07:26:32,17
66,Project national sort cause today husband analysis.,2024-10-07T12:24:07,Johnny Romero,113,2024-02-26T18:24:20,23
67,Region the meet.,2020-11-30T11:39:43,Kevin Lewis,23,2022-04-02T18:17:43,16
68,Mother sit population may.,2024-11-12T21:14:43,Francisco Fitzpatrick,38,2021-11-12T00:05:06,30
69,Method against growth.,2020-07-24T17:56:31,Bryan Roth,123,2024-03-16T09:14:54,20
70,Task student usually always.,2024-01-31T22:59:50,Christopher Gallegos,32,2021-07-28T01:56:58,5
71,Memory situation range rate defense order already what.,2020-09-26T22:49:58,Glen Lester,50,2020-11-09T06:36:59,19
72,Meeting protect heavy rise foreign condition owner strong.,2020-09-11T10:16:43,Carol Orozco,31,2022-08-02T15:19:37,19
73,Middle consider finally sure daughter science meeting.,2020-12-15T02:04:40,Donald Daniels,49,2024-09-19T04:33:33,20
74,Thousand trouble door wind why whether letter.,2021-02-22T08:05:16,Samantha Simmons,57,2023-12-06T20:46:24,8
75,Impact again attack yes.,2021-09-02T20:43:46,Alyssa Martin,17,2020-09-09T22:35:28,18
76,Forget drive state natural look last.,2021-01-04T12:44:34,Miss Megan Raymond,46,2021-10-28T04:54:37,4
77,Care sound alone floor foreign yet project teach.,2025-04-06T02:31:55,Alex Mitchell,96,2020-12-12T04:02:34,5
78,Toward dark good star.,2021-12-03T21:33:38,Stacey Wilkerson,112,2023-09-10T19:33:43,20
79,Turn usually smile individual answer somebody.,2020-04-06T18:36:34,Elizabeth Key,129,2023-04-19T05:55:18,5
80,Government fish south always second happen wife worry.,2023-02-09T14:31:50,Courtney Rollins,35,2023-02-19T13:33:43,5
81,Talk mind data middle war reflect.,2023-10-06T11:19:13,Erica Parsons,85,2024-10-10T12:52:05,6
82,Price southern past me.,2023-05-16T14:42:36,Brandon Rose,39,2024-10-07T11:30:02,10
83,Price until generation own look official.,2020-10-20T18:22:09,Alyssa Foster,68,2021-07-26T21:25:15,13
84,Care peace person seem.,2021-01-31T12:11:25,John Johnson,56,2023-10-09T03:35:01,19
85,Service human food few within.,2025-03-11T04:45:08,Christine Rivera,109,2023-04-02T01:50:28,17
86,Travel same surface necessary.,2022-05-24T01:06:30,Katherine Curry,24,2022-12-02T04:40:10,18
87,Explain building rise act difference necessary.,2020-09-12T02:00:30,Casey Harris,3,2022-12-26T21:34:33,27
88,Physical plan think shake.,2024-08-01T18:35:45,Michael Caldwell,2,2022-05-14T22:57:09,26
89,Conference begin recognize while threat.,2023-12-21T03:36:15,Nancy Adams,100,2023-04-24T07:58:29,19
90,Serve black line bar break computer.,2022-07-30T21:06:30,Michael Gonzales,104,2023-05-27T19:07:11,1
91,Positive across voice could buy color surface.,2020-04-02T18:28:05,Kelly Molina,59,2023-10-21T11:10:23,7
92,Amount consider doctor feel either.,2020-04-13T11:56:51,Sarah Johnson,72,2022-05-27T09:32:00,9
93,Bad majority why.,2023-02-06T17:57:30,Ryan Wilson,106,2025-02-18T15:47:42,17
94,Stage resource peace.,2021-11-11T21:01:54,Angela Allen,112,2023-09-03T05:38:59,2
95,Experience serve crime upon thus however happen.,2022-07-02T06:17:12,Denise Wallace,14,2024-08-24T08:21:20,21
96,Executive act finish strategy politics.,2022-10-12T13:58:13,Amy Patterson,22,2021-09-06T02:28:39,19
97,Have word fire treatment peace after establish.,2024-12-23T16:18:02,Andrew Santos,77,2020-02-13T17:56:45,18
98,Organization will PM leader never sound.,2021-11-06T12:32:21,James Harper,62,2022-05-03T17:04:30,25
99,Reach themselves room civil.,2022-06-15T16:07:23,Molly Rose,23,2024-05-27T14:15:44,14
100,Reduce question after.,2021-04-16T23:33:36,Jessica Navarro,87,2023-08-05T01:58:32,6
101,Consumer city movie national.,2020-03-04T04:22:17,Sherry Wilson,110,2020-05-12T00:00:35,22
102,Student chair spring available yeah.,2021-09-08T16:55:49,Ms. Melissa Best DVM,3,2025-03-12T06:58:56,26
103,Study natural also.,2024-12-01T05:06:00,Gail Green,128,2021-06-24T06:01:04,18
104,Quickly wear edge play.,2023-11-05T05:21:24,Brooke King,87,2020-04-05T11:56:45,5
105,Public wide measure city television office.,2021-06-27T19:33:39,Clinton Scott,7,2022-09-27T04:22:47,23
106,Give difference country arrive create.,2022-11-02T08:38:26,Isaiah Hughes PhD,39,2020-08-23T03:24:53,25
107,Expert discussion always indeed often ask operation.,2022-08-25T06:31:08,Antonio Shaw,73,2024-06-27T09:08:07,29
108,Seven network wall education.,2023-08-24T20:11:00,Jacqueline Monroe,63,2021-06-27T11:32:09,27
109,Concern information third myself fight.,2023-01-26T18:04:37,Paul Duffy,124,2022-05-15T13:07:30,1
110,Change history ever serious pick.,2021-09-01T18:13:40,Michael Sullivan,89,2021-11-28T09:12:55,7
111,Assume election final there fish behind rest.,2020-02-05T14:14:52,Ryan Rodgers,81,2021-12-26T02:01:44,29
112,That identify laugh own.,2024-09-14T08:56:13,Stephanie Campbell,37,2023-12-06T13:39:06,8
113,Drive ability specific compare sometimes.,2020-03-05T13:24:39,Victoria Myers,98,2024-11-14T13:25:13,10
114,Worker third hard practice deal.,2021-09-03T06:29:26,Brandon Poole,80,2022-08-21T17:46:34,16
115,Standard natural quickly perform.,2020-05-05T02:05:31,Leslie Crawford,87,2021-09-22T11:58:33,24
116,Fight fire within security popular cultural team.,2020-11-26T20:43:19,Teresa Guzman,30,2024-04-06T17:09:41,30
117,Wife something chair on whose address hand would.,2022-10-07T21:34:37,Roy Caldwell,130,2022-08-07T18:06:31,30
118,Huge staff later accept community.,2024-05-22T07:49:40,Lauren Mendoza,107,2022-07-25T20:14:46,23
119,Chair official product whether school.,2023-11-29T02:04:34,Craig Lee,109,2023-07-07T06:36:42,7
120,Popular question step modern follow everything chair.,2022-10-27T00:54:28,Steven Huff,104,2023-08-19T02:58:55,8
121,Dinner stock manager early peace environmental.,2020-12-04T01:03:11,Mary Cain,98,2021-01-08T09:34:34,1
122,This exactly political speak specific should sing.,2024-06-28T12:35:30,Christopher Wade,98,2024-01-14T12:11:25,13
123,Address state thought argue treat finish.,2021-06-25T04:49:20,James Nguyen,87,2024-08-26T16:45:19,17
124,Easy toward gun spring.,2022-05-22T05:44:57,Cynthia Crawford,15,2025-04-08T01:33:03,2
125,Family ask task newspaper argue.,2020-12-30T08:56:51,Kenneth Hoffman,37,2021-06-03T09:41:41,17
126,Must little deep check during Congress.,2024-10-06T18:57:06,Pamela Sullivan,52,2020-01-07T08:00:43,9
127,Gas check like.,2022-09-18T23:24:23,Shannon Price,108,2021-06-09T12:30:07,13
128,Hear movement point rule.,2024-04-07T23:29:16,Brian Cunningham,47,2020-11-24T17:34:49,24
129,Health attack officer board.,2024-07-16T11:36:22,Sean Black,87,2023-12-05T04:44:06,30
130,Yourself young ago debate consumer issue.,2024-11-12T21:34:36,Melissa Rojas,8,2022-06-14T16:06:57,24
