id,category_name,cooking_time,description,created_at,dietary_preferences,image_id,ingredients,name,recipe_id,update_at,user_id
1,Category Category Admit,69 mins,Rest right site. School station statement. Quality dinner other.,2023-07-26T20:45:23,Halal,,"matter, question, sea, reveal, article",South Dish,a238be82-5641-442a-a65a-649cbd65598e,2023-01-05T20:01:19,
2,Category Category Series,27 mins,Draw stuff voice late check such. List summer cost share throughout.,2020-05-01T18:23:59,Halal,,"read, fast, time, program, evening",Even Dish,824791a2-4530-4c1b-aada-94aa44cdd6dc,2024-06-26T16:46:37,
3,Category Category Institution,69 mins,Himself thus performance choose like rule newspaper. Against drive number yet not maybe enough.,2021-07-04T19:10:59,Paleo,,"time, game, animal, religious, long",Notice Dish,c6733402-8b6f-445c-987f-adfd4ac77115,2022-05-05T22:08:32,
4,Category Category Rate,30 mins,Individual institution ever raise specific simply. Story whether recognize agent leg.,2024-05-18T02:19:05,Gluten-Free,,"thus, least, occur, whom, life",Reality Dish,1ad8a18f-ed3a-4746-bf43-709cde1a6746,2022-10-27T02:08:12,
5,Category Category Along,52 mins,Great race key music player usually. Control opportunity your.,2020-10-04T21:58:48,Vegetarian,,"measure, begin, enter, shoulder, address",Particular Dish,2300a52e-a574-439c-861f-164c1b23026d,2021-03-18T08:48:14,
6,Category Category Key,43 mins,Happy four project. Plan store movie I today.,2023-06-26T10:10:35,Gluten-Free,,"newspaper, cell, beautiful, affect, clear",Size Dish,8ab5d7e6-5913-4e5a-80ff-915c4653dfc0,2023-12-10T15:11:59,
7,Category Category Research,85 mins,Collection your affect event vote.,2020-09-30T01:24:40,Vegan,,"pretty, professional, space, baby, yes",Trade Dish,a85b602b-bc7b-4f38-a174-0cce0831fcde,2021-09-04T06:16:09,
8,Category Category Important,20 mins,Hot argue few window evidence defense. Contain go section.,2023-11-22T20:38:28,Vegan,,"there, arm, nice, south, key",Under Dish,76590e49-cd7c-4af8-a1c3-fd39f4f7c979,2020-03-11T08:02:46,
9,Category Category Research,83 mins,Stuff energy name. Whom push everyone realize.,2024-09-15T00:25:54,Low-Carb,,"how, commercial, simple, full, necessary",Near Dish,6ab98b6c-cf0a-4b76-95ba-20f2826058d8,2021-08-10T04:35:32,
10,Category Category Other,24 mins,Simple travel Mrs though.,2020-11-24T12:33:26,Vegetarian,,"send, real, human, area, value",Have Dish,41dc4ac9-a7de-4842-89e5-ee395fbd9ee8,2020-04-10T17:45:27,
11,Category Category Health,43 mins,Police company federal they return. War goal total serious.,2022-06-03T16:12:38,Vegetarian,,"serious, brother, guess, world, ok",Near Dish,7f463688-d4a0-42ae-bfdb-92b659641f80,2023-10-21T07:49:40,
12,Category Category Dream,49 mins,Add eat director old. Enough contain some sea book.,2024-05-29T11:30:34,Gluten-Free,,"material, few, space, rest, receive",Bring Dish,6d222f82-5221-4e11-9015-da9c9ab9666b,2022-08-17T05:44:30,
13,Category Category Why,81 mins,Last food shoulder whose threat box. Build allow toward town.,2022-01-26T22:49:52,Halal,,"science, wide, natural, affect, draw",Research Dish,1d8ab93e-9206-4cb6-bb10-7a4118602a88,2024-10-12T23:27:16,
14,Category Category Receive,12 mins,Fall heart she son. Process no let. Quickly imagine while.,2022-09-25T18:29:07,Keto,,"challenge, so, often, much, provide",Go Dish,0b105f61-e108-4ded-8bef-3e42a439b0ba,2021-08-27T02:23:17,
15,Category Category Street,65 mins,Sing computer recently she. Gas prepare significant room task.,2021-09-03T21:39:13,Low-Carb,,"factor, less, first, adult, leave",Money Dish,d29059b4-4eab-40d8-95de-e5368ed04c33,2024-03-12T05:50:15,
16,Category Category Key,81 mins,Decision should theory officer foreign. Across stay politics writer. Weight occur news after.,2025-01-12T02:31:11,Vegetarian,,"nation, at, woman, religious, child",Better Dish,d3fa4652-a482-452d-a97b-ee095108cfe4,2024-10-31T20:19:17,
17,Category Category Collection,57 mins,Born state crime million. Recently anyone husband might.,2022-05-19T12:34:21,Vegan,,"sport, recently, staff, there, run",Decide Dish,c73ddf50-9dcc-475a-9fb9-fe02ed61dbd5,2023-03-25T14:03:22,
18,Category Category Money,44 mins,Arrive fire pass. Support require between through say at read who. Recent try seek their.,2024-05-23T17:34:34,Vegan,,"drop, third, catch, speak, radio",Market Dish,1aa4dead-f328-4273-bb40-6acb55685ede,2023-06-23T19:25:02,
19,Category Category Involve,61 mins,Short capital billion beautiful still. Study before century mean.,2021-08-25T08:21:42,Vegetarian,,"recent, card, political, necessary, city",Without Dish,136072da-8fea-43b6-a85f-c21690919830,2023-05-05T05:36:44,
20,Category Category Manager,15 mins,Myself big base yourself. Door really she provide TV wind. Real seek either pick.,2020-07-22T14:16:05,Gluten-Free,,"say, tough, maybe, others, know",Bill Dish,67151e30-7594-4d9a-9982-484b60a76ee9,2024-03-05T02:46:43,
21,Category Category May,23 mins,She read against try you leave. Senior former news news past right water.,2023-06-19T21:28:37,Halal,,"shake, laugh, mind, media, instead",Environment Dish,e389223a-d0bb-4905-9755-b5643f1b894d,2021-05-13T04:49:51,
22,Category Category Worker,81 mins,Charge under benefit. Education south able purpose base. Paper support nor white physical.,2020-02-23T05:20:05,Vegetarian,,"develop, would, write, challenge, safe",Drug Dish,267c2075-14e3-4fb4-b175-dce3f8eeca0e,2023-06-01T21:40:28,
23,Category Category Series,66 mins,Recently program offer success audience party TV. Sign ago doctor. Surface board consider model.,2023-01-22T20:57:55,Gluten-Free,,"suffer, better, future, others, growth",Between Dish,79f45dfa-70ab-4db7-8ec3-2b14d0128710,2021-05-25T21:52:27,
24,Category Category Natural,25 mins,Hospital language song present she. Low even appear choose unit account.,2024-01-19T10:49:16,Vegetarian,,"whose, street, store, provide, reflect",Debate Dish,9bf88f5a-8c6f-440c-b073-c3856775b310,2023-01-06T11:10:25,
25,Category Category Bag,23 mins,Government expect remember that boy chance. While themselves view sport fill. Soon cut pass cell.,2023-12-10T17:01:23,Keto,,"serious, while, may, affect, child",Customer Dish,3a07059b-482a-4b86-b647-a1c62bcf8fe4,2024-07-04T12:46:38,
26,Category Category Feeling,72 mins,True only responsibility day. Trouble easy attack find. Physical especially huge bank might.,2022-09-06T15:21:26,Vegan,,"fast, human, energy, pay, camera",Political Dish,e1e8d2b9-7eb5-4e74-8988-3912c8e72e1e,2021-03-28T04:26:58,
27,Category Category Half,46 mins,Individual affect network brother. Loss cold very.,2021-10-31T21:40:06,Vegetarian,,"room, it, he, pressure, short",Describe Dish,d9e0cc0b-500d-4183-a6ec-9a00e3df9ce6,2021-08-05T19:11:27,
28,Category Category Almost,33 mins,"Contain among bed term event thing when.
Chance both heavy catch network.",2020-02-24T10:47:19,Gluten-Free,,"as, task, argue, senior, race",Condition Dish,8267ac35-bbde-4adc-b17d-51257befe0b7,2023-12-28T01:18:39,
29,Category Category Red,64 mins,Him against social fund. Admit painting major where. Choice worker firm until data.,2022-11-09T00:31:28,Low-Carb,,"likely, really, newspaper, cell, play",Various Dish,9e84a4f9-3cd0-46ff-909a-e4b8a43e293e,2023-04-24T18:23:32,
30,Category Category Pick,70 mins,City stand suddenly. Improve need new reduce serve. Camera race them learn treat high dream have.,2022-06-14T09:27:26,Paleo,,"start, attack, commercial, argue, on",Herself Dish,62e13324-62fa-4bf3-a4d4-f122497d529c,2023-06-10T06:10:29,
31,Category Category Industry,50 mins,Every court here own bank cost accept especially. Road music month.,2021-05-30T06:13:13,Paleo,,"article, price, forget, second, investment",Which Dish,35757a33-c5f7-41dd-bf20-ed6fddd10ab7,2023-10-02T11:01:54,
32,Category Category Second,82 mins,Apply up religious. Member poor of doctor owner. Method consider year can.,2022-08-15T19:13:58,Vegetarian,,"save, vote, thing, million, attention",Week Dish,ff5a4183-3a8b-4d9b-9feb-d18caf39e27f,2023-08-24T01:07:59,
33,Category Category Dream,71 mins,Fight arm discover six attorney control well two. Activity new talk move bit change.,2021-10-02T01:33:45,Vegetarian,,"walk, none, whole, least, cold",Too Dish,66ebed5f-9a4d-4985-a1f4-cdcf2edd7aee,2021-08-23T16:10:10,
34,Category Category Wind,34 mins,Than surface age subject field. Give father board bring home some.,2020-08-18T00:27:54,Vegan,,"leg, direction, seem, bed, group",Look Dish,9a5fb772-d232-4ec9-b537-6b4e0c6d2dd5,2024-09-23T22:32:03,
35,Category Category Her,41 mins,Most source guess with ever current ball look. Model choice conference song affect.,2020-02-20T19:14:16,Low-Carb,,"foreign, occur, hair, cold, let",Identify Dish,c9e7c31b-c540-405a-8412-5b358873ad39,2021-12-18T11:00:57,
36,Category Category Fight,65 mins,Join itself value generation painting. Still event cover step you answer just. Tend may and.,2020-06-10T12:15:32,Vegetarian,,"for, newspaper, avoid, trip, trouble",Travel Dish,c8bca42e-51b0-4f5a-8693-afa0b11c475a,2022-06-21T16:15:37,
37,Category Category Most,71 mins,No hundred fly case most so. So stock treat trade employee benefit.,2023-12-29T18:08:04,Low-Carb,,"skin, too, themselves, without, ready",Training Dish,c4795f1e-d92b-49ab-b9fb-7a4930e930ff,2022-09-18T14:04:52,
38,Category Category Within,54 mins,Tax probably rise increase.,2022-10-20T11:36:04,Halal,,"owner, life, fear, travel, appear",Degree Dish,0401a5ab-96f7-4599-80fc-3f8962ddea2b,2021-04-13T20:06:05,
39,Category Category Main,46 mins,Food threat government current majority nothing. Bag soldier ever position capital wrong half.,2024-09-06T10:07:42,Keto,,"concern, realize, especially, worker, rise",International Dish,e2cae8d4-18b3-4de7-8f88-87d070285699,2020-11-01T06:47:44,
40,Category Category Growth,77 mins,Item seven school play material effect.,2024-06-21T05:23:11,Gluten-Free,,"magazine, business, live, effort, car",Because Dish,56a9a391-4cdf-43bb-ac8f-07715d94bd2f,2023-08-18T14:49:28,
41,Category Category Bad,42 mins,Say child fire together we exactly into.,2021-07-17T02:54:01,Low-Carb,,"under, suggest, project, paper, company",Tough Dish,d284ddbd-d61d-4193-a3d9-6281ec2af31a,2022-12-31T22:56:38,
42,Category Category Along,52 mins,But mind anything day prepare including entire. Center memory build hit guy natural.,2024-04-14T03:06:22,Low-Carb,,"difficult, field, reduce, apply, show",Congress Dish,b39e69ae-bf9c-482c-a241-97b69c6cd2e3,2020-01-10T20:16:21,
43,Category Category Purpose,52 mins,Senior sometimes long beyond just their however. Away through stop floor country could.,2022-05-29T16:45:03,Keto,,"owner, popular, skill, edge, fear",Any Dish,2f671114-b565-41b1-92b8-9ee852906dc0,2024-02-25T14:07:14,
44,Category Category Involve,55 mins,Difficult stop culture detail writer. Work Congress seem the reason edge.,2022-01-27T10:24:21,Halal,,"environmental, ability, form, deal, follow",My Dish,b0967bfe-8df9-4613-8d7e-c47d9b6de5d4,2022-11-16T12:43:21,
45,Category Category Smile,45 mins,Discussion stand receive huge defense. Sometimes wait up fire especially.,2023-07-29T10:30:20,Gluten-Free,,"young, along, picture, full, debate",Fight Dish,b3cd5714-ae18-4714-90f5-63ef5c1e565b,2024-01-19T09:45:38,
46,Category Category New,84 mins,"Over realize agreement late film dark each. Realize trial nice stop attention.
Near view matter.",2022-07-27T12:21:11,Vegetarian,,"morning, public, movie, education, image",Dream Dish,09f39963-60b8-4b67-aa50-0a9d978cc9f4,2024-12-12T12:06:58,
47,Category Category Rest,68 mins,Training rock call blood hair.,2024-05-12T23:19:04,Vegetarian,,"concern, single, structure, significant, president",President Dish,cda6ad5c-7000-4bc3-9477-489bf0ac9235,2021-07-28T09:06:58,
48,Category Category Card,22 mins,Remain house ago challenge way. Charge today bar.,2022-06-17T04:37:39,Vegan,,"approach, form, learn, effort, collection",Yourself Dish,2af48f81-4ad7-4e97-a437-86e4904f49dc,2021-03-26T11:15:05,
49,Category Category Resource,56 mins,Position within do civil day understand. Travel build husband.,2023-02-19T22:00:02,Halal,,"true, size, among, bring, cut",Should Dish,559cedc2-150d-43ce-bf76-e3eb473180cd,2023-05-08T13:39:04,
50,Category Category Important,86 mins,Nearly fall everyone white particular newspaper space. Figure home them hear every power.,2023-10-04T04:55:10,Keto,,"education, since, class, health, ask",Either Dish,49ae5f1d-0011-4ff3-aa9e-a29812f387cd,2022-06-02T02:15:57,
51,Category Category Rate,41 mins,Decide away knowledge no state. Set when today pressure which will.,2024-01-19T14:32:58,Halal,,"else, impact, budget, pick, hand",Course Dish,6fcc0465-8636-4630-a236-5c5d9c26a587,2023-08-31T02:27:59,
52,Category Category Simple,84 mins,Ever go several trip. High region consumer left even could system.,2021-01-18T03:50:21,Halal,,"treatment, when, language, series, air",Discover Dish,46734709-224a-4fd0-a995-49787d5766c2,2021-12-01T17:52:07,
53,Category Category Involve,56 mins,Mind final that catch today. Majority table remain woman when must rich begin.,2021-03-17T04:14:31,Vegan,,"physical, Mr, democratic, card, trade",Take Dish,3f534599-1099-49bd-b76b-1f379662d2ce,2021-05-24T15:13:35,
54,Category Category Real,14 mins,After establish security seem drop door system. On financial glass protect.,2021-11-20T14:04:08,Keto,,"several, claim, when, purpose, treatment",Plan Dish,c2336d73-6359-498d-8d98-47125d0bbde8,2020-06-18T04:20:03,
55,Category Category Resource,73 mins,Serious yourself capital short both defense green. So door teach job range.,2020-03-24T16:31:45,Halal,,"follow, just, investment, beat, make",About Dish,4701d2b2-6af2-4f52-afc6-1358c3c18749,2024-07-19T06:21:00,
56,Category Category Main,13 mins,Base rest difficult in kind economy second. Value civil animal rest.,2021-05-16T17:32:42,Vegan,,"nation, begin, sell, general, response",Leader Dish,6952b1f4-8df6-4cf0-9c7b-e9165da73311,2023-03-20T21:01:26,
57,Category Category Mother,38 mins,"Explain team some statement management.
Occur box wear. Learn trip example itself head service.",2022-01-02T16:06:27,Gluten-Free,,"will, leave, blue, consumer, speak",Government Dish,c64f1b12-25b8-40d2-98f2-51d4264d1027,2024-03-07T01:05:44,
58,Category Category Brother,39 mins,Position prevent lot yet add author wait such. Thing chair put art cover training space.,2020-07-05T19:21:05,Low-Carb,,"may, art, knowledge, question, think",Cold Dish,be6b1ca9-10c0-4f22-9332-6c935df3e9da,2023-08-29T01:27:04,
59,Category Category Former,39 mins,Say girl billion. Store tax school organization carry marriage cup. Lead near various cell seem.,2021-10-18T00:50:27,Paleo,,"hotel, author, west, peace, allow",Water Dish,2a85b96b-9a5a-4550-9ec0-8f1774e1a266,2021-11-04T14:13:00,
60,Category Category Real,26 mins,Political debate final might travel pass model.,2024-02-01T22:45:48,Low-Carb,,"performance, lay, tonight, prevent, small",Enter Dish,4812a78e-25d1-47c7-aaab-43841ffe7e7f,2020-11-10T21:41:57,
61,Category Category Later,18 mins,Upon whatever late. Staff operation entire image including three. None stage science government.,2024-03-10T06:10:11,Keto,,"consumer, accept, boy, yeah, happy",Less Dish,5345c91e-9d0b-41be-afdd-b35eba3dcb8e,2020-02-21T13:42:24,
62,Category Category Pass,57 mins,Generation part trouble alone accept half. Cold million seek several next.,2020-12-21T17:50:51,Vegetarian,,"traditional, night, story, develop, information",Full Dish,7f544c34-1703-4fe2-8e6a-5a749fc7294f,2020-10-23T17:08:58,
63,Category Category Most,90 mins,Sport when discuss approach business paper. Hard indicate maintain word food organization together.,2022-12-10T19:28:03,Low-Carb,,"radio, until, weight, news, imagine",Perhaps Dish,e59b02a7-3125-40e8-a162-ad4c134ae950,2024-08-16T17:08:58,
64,Category Category Question,56 mins,Good food certain group. Realize listen never into decade rate.,2021-03-23T12:02:28,Halal,,"certain, fall, stuff, thousand, account",Member Dish,b5a0c00a-8757-422e-9c27-d7410cd03064,2020-09-06T15:23:28,
65,Category Category Generation,10 mins,Brother fast early run soldier education. Treatment face model four.,2022-10-20T00:59:23,Paleo,,"what, federal, range, outside, term",Mission Dish,93564bd1-5f02-484e-ab6a-f71f0d5be390,2021-08-14T03:43:40,
66,Category Category Let,19 mins,Case main serious provide form despite. Result laugh focus program find land nearly.,2021-07-18T02:18:40,Paleo,,"gun, sell, first, ten, soon",Usually Dish,2ee2b89d-93fb-4d48-89d2-6a3eafffbb37,2020-01-30T03:39:44,
67,Category Category Natural,69 mins,Set pattern car Congress. Study beautiful commercial. Resource middle usually along house history.,2024-01-17T00:53:21,Vegetarian,,"others, speak, talk, same, concern",Traditional Dish,523e3965-43f5-4a14-a20a-b2eb817d9482,2024-06-06T04:35:13,
68,Category Category Sort,34 mins,My member project increase your citizen million. Both security rest agreement add author.,2020-04-24T06:18:34,Halal,,"black, head, amount, forget, would",Positive Dish,3e7e434c-fef8-4e11-9e3a-87e33b138edf,2024-04-17T22:08:21,
69,Category Category Industry,34 mins,Likely relationship race whose safe energy. Magazine seat also shake knowledge also remain.,2020-04-29T19:18:23,Keto,,"sign, others, put, war, opportunity",Take Dish,7079509e-6a7d-4bce-b525-315aeb81003b,2020-08-04T09:47:27,
70,Category Category Special,81 mins,Cultural represent order necessary blood enough two prove. Social news move oil maintain party.,2022-01-01T18:00:12,Gluten-Free,,"focus, this, operation, treat, control",Production Dish,ffd4c75d-de20-4936-8078-9afc6b610675,2022-02-07T22:14:05,
71,Category Category Receive,44 mins,Personal room contain magazine. Of any pressure we institution son character walk.,2022-09-21T06:20:47,Vegetarian,,"simply, recognize, play, scene, avoid",Dream Dish,08d9bb6e-2009-4ab6-a84e-8c79cbc16cb6,2025-03-07T02:36:12,
72,Category Category Well,47 mins,Behind civil up response itself magazine. Service particularly officer marriage.,2023-09-21T19:07:30,Vegetarian,,"near, hit, sort, nature, again",Position Dish,aac86520-09ee-4279-913d-6646291ab583,2020-11-14T22:09:23,
73,Category Category Adult,23 mins,Yard happy several fly join. Investment wide break other about.,2020-01-09T00:52:22,Gluten-Free,,"hotel, what, sit, whose, decide",Economic Dish,d28c879c-547b-41e8-9eb7-0de80150f8c7,2022-05-01T05:40:46,
74,Category Category Former,35 mins,"Else measure interesting store toward. Walk rock story.
Model inside wide low painting wall.",2024-10-25T10:25:53,Vegetarian,,"population, consider, brother, laugh, future",Thousand Dish,792d2c7b-760a-4e59-bb8c-99212fbb57e6,2022-02-13T07:56:15,
75,Category Category May,13 mins,Service out on. Open treat employee I buy rate federal.,2021-04-14T00:52:37,Halal,,"politics, bill, left, wall, news",Series Dish,d88a57e4-3e1c-412b-b2cb-4b639fffe2c0,2023-10-05T23:50:52,
76,Category Category Return,14 mins,Fire mouth seek list magazine successful. Term on team size wear book.,2021-06-23T20:30:33,Halal,,"war, voice, month, space, hundred",Step Dish,9e8bfdc4-cb02-4d9b-9c47-3f8be815d5da,2021-12-18T18:57:27,
77,Category Category Within,76 mins,Education change nothing. Might whom discover from my school life street.,2020-06-19T12:10:05,Vegetarian,,"measure, value, mind, force, I",Above Dish,2c8999a7-6156-449c-81e2-920f7274b88b,2025-04-16T10:17:06,
78,Category Category Within,24 mins,College leave type particular decide consider. Fly market character life.,2020-06-23T15:00:09,Low-Carb,,"this, product, entire, pattern, full",Memory Dish,0b4f8e70-9799-4f26-885a-5a6eebf40171,2020-06-15T21:54:42,
79,Category Category Growth,33 mins,Wonder shoulder history. Already through sign book course account. Because purpose condition.,2024-04-09T09:20:38,Low-Carb,,"tax, what, detail, high, light",Image Dish,7607bba3-2464-40b5-8da2-aa354dbc9d94,2024-04-13T17:33:24,
80,Category Category Well,49 mins,Morning raise cause sort nation out. Answer institution friend water decide.,2023-05-28T15:42:36,Gluten-Free,,"war, fear, dream, though, expert",Likely Dish,3691251d-9af9-4a18-8c3a-1263440094aa,2025-01-17T04:00:01,
81,Category Category Responsibility,71 mins,Run itself sign science. Certainly any growth describe win baby as.,2023-05-05T06:18:22,Vegetarian,,"person, practice, leave, they, student",Policy Dish,d472f22a-abfe-4f2d-8c0b-86b8ccb5af19,2024-07-24T19:03:05,
82,Category Category Ever,78 mins,Amount ok seek story.,2020-06-24T16:26:09,Keto,,"with, change, magazine, tell, assume",Try Dish,1386bdfd-fba2-4275-aca0-73ba941266a3,2023-08-30T03:22:40,
83,Category Category Collection,43 mins,Either nation billion. Apply Mr his boy. Admit already control them. Well artist growth billion.,2021-02-10T05:12:41,Vegan,,"pattern, front, last, put, old",Country Dish,70b6e3b2-5b06-428b-ad63-921737e74ffd,2020-10-06T05:51:41,
84,Category Category Important,81 mins,Century dinner place small century. Usually across wait anything week.,2022-08-18T15:25:09,Keto,,"establish, vote, investment, church, other",Main Dish,cbff826d-8b66-4ce8-9186-bd95fdeec50b,2023-01-12T15:30:55,
85,Category Category Along,58 mins,Already page manager painting community collection. Bill church send film.,2020-04-15T04:04:06,Keto,,"trial, throughout, scientist, carry, thus",Organization Dish,2ea17c62-d5a5-489a-8153-0082851e3649,2024-04-17T10:54:35,
86,Category Category Really,24 mins,Fall national protect dream argue. Your weight rest knowledge myself.,2023-01-27T09:31:01,Gluten-Free,,"play, white, stand, high, resource",Plant Dish,bfc23032-18c0-48f6-a902-2a16e22b7081,2023-01-29T18:03:01,
87,Category Category Let,55 mins,North have score report. Main someone question nature the us. Little look second rule.,2020-03-08T03:50:34,Paleo,,"network, several, color, leader, without",Camera Dish,bd7a2784-b0b9-47ce-b263-4c1b622fabff,2022-02-18T03:42:40,
88,Category Category Question,38 mins,Consider maintain area oil wife issue to. Land house lawyer executive employee give difficult.,2022-04-17T23:10:57,Halal,,"ago, our, nearly, security, information",Method Dish,662524d5-a292-4c5c-92de-6abda6640e96,2023-10-24T20:52:11,
89,Category Category Activity,21 mins,Management wish fund. Street trouble lead again break. Take model moment also woman.,2024-06-09T09:53:29,Vegetarian,,"service, together, appear, concern, when",Middle Dish,6e558d0b-3883-4bfb-b08b-5583f2a8037c,2020-04-26T15:43:08,
90,Category Category Later,21 mins,More cover score than.,2023-01-23T13:51:09,Low-Carb,,"rise, back, throughout, pretty, go",Exactly Dish,73c79a31-34ab-4105-b0ba-114e009978d5,2023-01-13T08:16:09,
91,Category Category Research,67 mins,Back among once. Sign later green husband center film all day. Middle letter exactly movie example.,2022-09-20T03:35:53,Vegetarian,,"face, evidence, spring, report, natural",Whose Dish,c50fbe19-4fc8-4a58-bc1c-d81b298d175b,2024-11-18T16:38:50,
92,Category Category Join,10 mins,Nice quickly water country production off. Toward before six.,2023-07-02T20:23:33,Low-Carb,,"cultural, play, media, occur, item",Reach Dish,665f6d50-1ade-4fa2-97f4-1ebd9c5d7a03,2021-11-08T07:55:30,
93,Category Category Tell,29 mins,Specific bit close program hair work information social. My move eye hotel. Sure quality sit.,2020-02-29T17:59:03,Gluten-Free,,"clearly, billion, draw, yard, since",Decade Dish,eabeaa85-dc39-4028-9581-20d01fe79fe8,2022-10-12T11:12:35,
94,Category Category Phone,60 mins,Despite factor impact assume course despite. Final analysis design town reality understand size.,2020-01-11T04:45:48,Vegan,,"of, four, war, large, seven",Amount Dish,18b7e41e-3615-4ca9-bd9f-1639dced4520,2022-11-18T16:53:58,
95,Category Category American,87 mins,Beyond buy brother summer. Person author spring rule. Back sport decision generation assume.,2023-10-03T13:32:48,Vegetarian,,"nothing, wife, less, stage, drop",During Dish,88d15773-3297-4b26-9a45-0c1db4c3a65c,2020-08-30T07:22:42,
96,Category Category Institution,71 mins,How heavy series trade live idea good. As expert reason middle century same quickly.,2023-02-22T22:23:35,Vegetarian,,"several, response, list, thing, yard",Write Dish,34376dc8-14e5-4e89-b77c-785806a494da,2021-02-25T00:04:19,
97,Category Category Let,50 mins,Investment guy change well store. Hard sea drive important.,2021-03-28T14:45:42,Keto,,"my, picture, voice, church, order",Also Dish,2a98d08b-19e0-4853-b5e5-70872e111fd4,2024-02-03T01:59:10,
98,Category Category Style,21 mins,Anything life management business keep different. Fear return lay though stop last what free.,2023-09-29T17:32:08,Keto,,"single, itself, court, citizen, simply",Research Dish,4613b6d5-c976-46bf-9d55-09cb2f0ddaee,2021-07-20T07:43:54,
99,Category Category Usually,78 mins,Quite wall hard material hotel. Never that wear dog. Name we similar leg pretty whole everyone.,2021-03-13T22:17:41,Vegetarian,,"common, meet, behind, receive, Republican",Stuff Dish,8d5f948e-7ec6-40c0-9552-b4488b3aac56,2020-03-15T10:12:41,
100,Category Category Reason,24 mins,Bar bag scientist or affect war real deal. Road despite stay both science. Whom best professional.,2021-05-03T16:06:09,Vegetarian,,"hold, if, a, figure, laugh",Be Dish,b21fa039-7e1e-446e-9746-74ce35d5a698,2020-08-09T10:19:38,
101,Category Category Important,62 mins,Step source book back. Ever institution fear window yourself should move.,2021-02-13T13:21:50,Halal,,"community, hour, admit, movie, act",Within Dish,879b5948-4944-4f99-8dfa-8d15430505a6,2022-09-09T20:14:00,
102,Category Category Resource,37 mins,Mouth we star discuss firm.,2021-11-28T02:57:15,Vegetarian,,"down, order, alone, ago, think",Statement Dish,b175afab-8429-4132-a9bc-f264cc57f8d5,2022-01-14T01:32:24,
103,Category Category Consumer,79 mins,Suffer order way especially finally fact.,2024-11-29T22:56:11,Paleo,,"young, a, social, road, write",Benefit Dish,3ff48cbf-53a0-41e0-bf4f-1c571b172ef3,2021-12-01T16:10:39,
104,Category Category Later,50 mins,Message or baby hold your. Figure change star his difficult general out rich.,2023-12-22T16:53:13,Vegan,,"situation, someone, two, what, relate",Civil Dish,5376b02e-9b78-4cab-b43d-bee76bea3c00,2022-02-08T07:26:15,
