id,category_name,cooking_time,description,created_at,dietary_preferences,image_id,ingredients,name,recipe_id,update_at,user_id
105,Category Category Close,42 mins,Week around stock. Building place shoulder half. Research yourself director today.,2022-12-03T10:34:12,Vegan,,"onto, enter, clear, early, down",School Dish,e2b02218-157b-4da0-9e94-7fc23b3b0e30,2023-09-01T15:01:51,
106,Category Category Have,21 mins,Usually weight discuss argue. Simply billion minute home.,2024-12-28T15:17:32,Gluten-Free,,"tend, can, nature, half, just",System Dish,016c96d4-69e2-4713-9c12-89d5a63edaa9,2020-06-05T16:55:55,
107,Category Category Serious,82 mins,Base growth become deep table. Traditional like nature imagine. Beautiful person page cover.,2024-10-30T03:12:51,Paleo,,"young, Congress, sister, exactly, meeting",Watch Dish,fa9faeb6-3398-493d-b3cc-dd18ce1b2c9e,2023-02-25T03:26:47,
108,Category Category State,25 mins,Fact professor ground relationship respond Mr. Personal together itself want.,2021-08-02T16:39:23,Vegan,,"those, finish, site, join, first",Account Dish,29e88d9f-264d-4ab0-adae-4321b6338e9f,2024-03-16T04:33:10,
109,Category Category Involve,65 mins,Entire budget again class together general.,2022-05-20T19:12:36,Keto,,"before, career, various, much, wide",Weight Dish,f5fa277a-95a0-45ec-b770-bd58cd5bbe37,2022-11-14T14:29:33,
110,Category Category Important,14 mins,Whole rise page within security. Past industry item since minute shoulder partner hospital.,2023-10-10T14:59:37,Gluten-Free,,"charge, game, move, religious, already",Medical Dish,07fe50de-ba0c-4433-880d-01bbd62b4160,2022-05-01T08:58:05,
111,Category Category Fine,80 mins,Scientist instead college establish. Computer probably money between. Sport interview cell attack.,2024-09-21T14:53:51,Vegan,,"only, early, mention, continue, include",Artist Dish,eef127a4-0d9d-4c44-9404-216cdfa2bfeb,2020-01-22T04:38:20,
112,Category Category Education,21 mins,Thank seem key far then. Four month wish research. Usually myself measure beat.,2023-03-28T18:34:40,Gluten-Free,,"teach, challenge, hour, present, economic",Father Dish,12063032-7851-47c0-b414-15e896adeae9,2024-10-04T06:01:48,
113,Category Category Finish,33 mins,Figure director my without. Play all keep three recognize property recognize.,2023-04-27T13:31:52,Vegetarian,,"Republican, drop, pull, whether, argue",West Dish,7cc2e24c-f7e0-411c-9226-fc4890e2cfdd,2022-07-01T22:34:06,
114,Category Category Include,65 mins,"Worker although south carry air series try.
College that remember.",2021-03-08T21:01:36,Gluten-Free,,"simple, middle, sing, building, the",Account Dish,7eb5f2bc-6e74-4391-b6b7-832b3c3542f2,2020-01-12T20:55:58,
115,Category Category Natural,20 mins,Form detail opportunity two. Cut start place. Line least whose thousand baby suffer.,2021-08-08T15:13:19,Vegan,,"news, eat, Congress, easy, adult",Expert Dish,27668516-6b99-4b54-b738-aacd7e04023a,2021-11-10T00:59:10,
116,Category Category Image,27 mins,Support animal ask responsibility possible condition cost.,2021-03-19T08:24:10,Halal,,"audience, laugh, term, step, heavy",Kid Dish,ef035c5f-37ac-4210-b1f2-07e653f96972,2023-04-18T08:06:23,
117,Category Category Time,76 mins,Theory do keep. Government note act war who style.,2022-08-03T11:14:54,Low-Carb,,"energy, knowledge, course, success, professor",Which Dish,91ca3350-33c3-4b75-a844-31672d29e8be,2022-01-31T19:07:58,
118,Category Category Join,49 mins,"With phone commercial.
Different agent card spring role. Fact thus talk year he card write.",2023-11-16T13:08:08,Halal,,"your, item, own, avoid, sell",Week Dish,c546e429-15ec-4bc6-8f89-efbf9c4c9c1e,2020-04-21T04:56:06,
119,Category Category Suggest,74 mins,Whom light western out return international always. Network other leader station rich worry exist.,2020-01-20T01:38:14,Low-Carb,,"will, drug, by, line, exactly",Issue Dish,98449d51-90d9-4432-96e8-9451b2e66e2a,2025-02-17T22:22:08,
120,Category Category Real,12 mins,Or challenge wife stand sign current. Shoulder dog interest production picture most.,2020-02-26T05:53:00,Halal,,"bed, result, race, western, difficult",They Dish,e5e9471d-0d1f-4224-a17a-d666d4f5402e,2024-07-08T22:57:35,
121,Category Category Serious,60 mins,Arm network room. Within account federal.,2024-11-25T04:17:18,Paleo,,"wait, significant, seek, sister, return",Produce Dish,612e5f09-83ba-411a-9996-3de0dce7bbe4,2022-06-01T18:13:02,
122,Category Category Fish,33 mins,Car black role member man today. Power third blood think. Entire strategy range watch.,2020-12-21T23:23:05,Vegan,,"generation, improve, occur, mother, heavy",Baby Dish,75b6b593-af43-4ff4-b04f-dbdc7da6bcf2,2021-01-03T16:08:57,
123,Category Category May,60 mins,Grow four order. Ready together she ten design. Join top down set question increase.,2024-11-26T07:25:35,Halal,,"determine, food, each, subject, as",Central Dish,341d96f8-348f-43fc-b818-d084591a1afe,2022-04-16T15:03:37,
124,Category Category Along,39 mins,He sure report owner already prevent raise. Either within theory stop some true test.,2020-02-13T13:12:47,Paleo,,"computer, skill, live, as, sometimes",Theory Dish,e8f4cccc-6520-48d7-95c0-2a598c0d3c9e,2024-09-05T10:29:22,
125,Category Category Technology,27 mins,Ok buy dog seven. Whose leader choice worry whole.,2020-02-17T15:26:04,Halal,,"your, few, fire, cover, process",Order Dish,82236100-0ec5-4222-a792-ab38c5b61287,2020-11-22T17:22:29,
126,Category Category Responsibility,26 mins,Economic PM focus. Service head once production quality treatment.,2022-11-12T07:56:56,Vegetarian,,"government, drive, build, five, onto",From Dish,126fa6c1-e6f5-4365-86bb-c0bb66d998b2,2020-01-12T23:29:34,
127,Category Category Why,24 mins,Movie animal care them thought because young. Within ready fear that cover oil.,2020-12-27T00:05:36,Low-Carb,,"reduce, growth, in, surface, building",Research Dish,0a555c57-d4ca-4a73-99c4-a3e502db68cc,2024-08-28T16:35:21,
128,Category Category Return,36 mins,Inside PM piece their thought. Since me quite about.,2022-04-05T02:12:18,Gluten-Free,,"part, indicate, family, business, reduce",Save Dish,925a6abd-9b7d-46a9-a774-e0aa7dd771a2,2021-05-28T01:21:21,
129,Category Category Resource,36 mins,Source move pick might. White often result whether by free.,2020-05-30T03:28:02,Vegetarian,,"wait, blood, travel, offer, travel",Put Dish,f28bafa5-54bb-4419-86bd-e868c5274314,2022-05-20T13:28:23,
130,Category Category Within,68 mins,"Method city law so.
Prepare serve cut catch economic.",2020-10-27T14:07:37,Vegan,,"beat, program, after, across, book",Stuff Dish,5d22f4cf-881f-456e-9102-6b622e176a15,2023-07-01T19:46:16,
